"job_id","job_title","location","salary_currency","salary_min","salary_max","job_quals","website"
"40673"," senior data scientist martech","United Kingdom","USD",129000,185000,"A/B testing; Banking; BigQuery; Causal inference; Engineering; Looker; Python; SQL","ai-jobs.net"
"40655"," data management specialist","United States","USD",56000,105000,"Data governance; Data management; KPIs; Privacy","ai-jobs.net"
"40701"," icqa data analyst icqa data analyst","United States","USD",92000,130000,"Angular; Data management; Data Mining; Excel; JavaScript; React; Research","ai-jobs.net"
"40716"," applied research machine learning phd summer intern","United States",NA,NA,NA,"Autonomous Driving; Computer Science; Deep Learning; Generative modeling; ICLR; ICML; Machine Learning; Mathematics; NeurIPS; NLP; PhD; Python; Research; Robotics","ai-jobs.net"
"40676"," senior data scientist","India","USD",129000,185000,"Agile; Classification; Clustering; Conversational AI; Data Warehousing; ETL; Excel; GCP; Jupyter; Machine Learning; NLP; Open Source; Pipelines; PySpark; Python; Scala; Spark; SQL","ai-jobs.net"
"40635"," principal data engineer adsmart","United States","USD",160000,2e+05,"APIs; Architecture; AWS; Big Data; Data management; Docker; Engineering; Hadoop; HDFS; Kafka; Kubernetes; NoSQL; REST API; Scala; Spark; SQL; Streaming","ai-jobs.net"
"40632"," lead azure data engineer with databricks empower remoteus based","United States","USD",62000,115000,"Airflow; Architecture; Azure; Big Data; Databricks; Data pipelines; Data quality; Engineering; Git; Kafka; Pipelines; PySpark; Python; Spark; SQL; Streaming; Testing","ai-jobs.net"
"40725"," bi analyst","Estonia","USD",48000,78000,"Agile; AWS; Azure; Banking; Business Intelligence; Data quality; Economics; Industrial; Mathematics; Power BI; Python; R; SQL; Statistics; Tableau","ai-jobs.net"
"40607"," senior scientist natural language","United States","USD",69000,128000,"AWS; Big Data; Computer Science; Data management; GCP; Git; LLMs; Machine Learning; Mathematics; NLP; PhD; Python; Research; Statistics; Unstructured data","ai-jobs.net"
"40658"," lead data manager","United Kingdom","USD",62000,115000,"Biology; Data management; Oracle; Research; Testing","ai-jobs.net"
"40697"," data analyst uk wide","United Kingdom","USD",42000,60000,"Computer Science; Data Analytics; Data Warehousing; Economics; Excel; Mathematics; Python; R; Spark; SQL; Statistics","ai-jobs.net"
"40616"," data analytics and insights analyst","Australia","USD",55000,102000,"A/B testing; BigQuery; Data Analytics; E-commerce; SQL; Streaming","ai-jobs.net"
"40695"," job  data analytics mid","Brazil","USD",55000,102000,"Agile; Amplitude; Data Analytics; Data visualization; Engineering; Power BI; Python; R; Research; Snowflake; SQL; Tableau","ai-jobs.net"
"40645"," senior data engineer governance","United Kingdom","USD",115000,180000,"Airflow; APIs; AWS; CI/CD; Data governance; Data warehouse; Engineering; Looker; Monte Carlo; Pipelines; Python; Snowflake; SQL; Terraform","ai-jobs.net"
"40675"," data scientist industry solutions","United States","USD",129000,185000,"AWS; Azure; BigQuery; DataRobot; Engineering; Excel; Feature engineering; GCP; Google Cloud; Machine Learning; ML models; MLOps; MS SQL; MySQL; OLAP; Oracle; Pipelines; PostgreSQL; Python; Redshift; SageMaker; Scala; Snowflake; SQL","ai-jobs.net"
"40728"," senior research scientist","United States","USD",89000,210000,"A/B testing; Python; R; Research; SQL; Statistics; Testing; UX","ai-jobs.net"
"40667"," data science software engineer","United States","USD",168000,210000,"Autonomous Driving; Computer Science; Data analysis; Engineering; Machine Learning; Mathematics; PhD; Pipelines; Privacy; Python; Statistical modeling; Statistics; Testing","ai-jobs.net"
"40693"," data analyst","France","USD",92000,130000,"Data analysis; Data quality; Data Studio; Data visualization; Privacy; Python; Snowflake; SQL; Statistics; Tableau","ai-jobs.net"
"40708"," abschlussarbeit identifikation der zweiraddynamik mit deep learning","Germany","USD",39000,73000,"Deep Learning; Machine Learning","ai-jobs.net"
"40710"," senior scientist deep learning","United States","USD",69000,128000,"Big Data; Biology; Computer Science; Data management; Deep Learning; Generative modeling; Git; Machine Learning; Mathematics; PhD; Prototyping; Python; Research; Shell scripting; Statistics","ai-jobs.net"
"40617"," senior manager data analytics and insights","Australia","USD",55000,102000,"BigQuery; Data Analytics; E-commerce; Finance; SQL; Streaming","ai-jobs.net"
"40684"," data quality analyst","United States","USD",85000,NA,"Computer Science; Data analysis; Data quality; Data visualization; KPIs; Looker; Mathematics; Pandas; Physics; Python; SQL; Streaming; Tableau; Teaching","ai-jobs.net"
"40662"," etl analyst","Singapore","USD",45000,84000,"ETL; Excel","ai-jobs.net"
"40722"," machine learning gpu engineer","United Kingdom","USD",51000,94000,"AWS; Blockchain; Computer Science; Crypto; CUDA; Deep Learning; GPU; Machine Learning; Maven; Python; Research; Rust","ai-jobs.net"
"40647"," senior data engineer intent team","United States","USD",146000,259000,"BigQuery; Bigtable; Computer Science; Dataflow; Data pipelines; Dataproc; Distributed Systems; Elasticsearch; Engineering; HBase; Kafka; Pipelines; Privacy; Scala; Spark; SQL","ai-jobs.net"
"40631"," data engineer","Norway","USD",115000,180000,"Airflow; AWS; Banking; Blockchain; Crypto; Databricks; Data pipelines; Engineering; Machine Learning; Pipelines; PySpark; Python; Spark; Streaming","ai-jobs.net"
"40642"," data engineer it corporate","Portugal","USD",115000,180000,"Agile; Banking; CI/CD; DevOps; Excel; Git; Hadoop; Linux; Scala; Spark; SQL; TDD","ai-jobs.net"
"40520"," associate media director data sciences","United States","USD",106000,167000,"AWS; Big Data; Clustering; Consulting; Finance; Machine Learning; Python; R; Redshift; Research; Spark; SQL; Statistics","ai-jobs.net"
"40541"," summer internship research scientist audio intelligence music mission emea or us","Germany",NA,NA,NA,"Computer Science; Engineering; GitHub; Machine Learning; Mathematics; NumPy; PhD; Python; PyTorch; Research; Streaming; TensorFlow","ai-jobs.net"
"40577"," manager data engineer","United States","USD",130000,NA,"Data Analytics; Data governance; Data warehouse; ETL; Excel; JSON; Oracle; Security; SQL; XML","ai-jobs.net"
"40583"," azure big data engineer","India","USD",30000,60000,"Azure; Big Data; Data governance; Data management; Data pipelines; Data warehouse; Engineering; ETL; Pipelines; Power BI; SQL; SSIS; Streaming","ai-jobs.net"
"40614"," energy cx data analyst lead","United Kingdom","USD",92000,130000,"CX; Data analysis; Data Analytics; Data Studio; GCP; Looker; Python; SQL; Statistics; Terraform; UX","ai-jobs.net"
"40530"," senior data science manager buyer trust remote north america","Canada","USD",144000,240000,"Engineering; Machine Learning","ai-jobs.net"
"40554"," data analyst manager research","United Kingdom","USD",42000,60000,"Agile; Excel; Research; Security; Statistics","ai-jobs.net"
"40508"," senior machine learning research engineer","United Kingdom","USD",51000,94000,"Architecture; AWS; Data analysis; Engineering; GCP; Keras; Machine Learning; ML models; NumPy; Pandas; Prototyping; Python; PyTorch; Research; SciPy; Security; Statistics; TensorFlow; Testing","ai-jobs.net"
"40589"," data analysis and visualisation consultant","Zimbabwe","USD",44000,81000,"Data analysis; Data Analytics; Data quality; Nonprofit; Statistics","ai-jobs.net"
"40598"," lead data scientist","India","USD",40000,61000,"Bitbucket; Data Analytics; Econometrics; Genetics; Python; R; Research; SQL; Statistics","ai-jobs.net"
"40601"," data strategy manager crm loyalty consumer experience ecommerce","Vietnam","USD",50000,93000,"Consulting; Data strategy; E-commerce; Engineering","ai-jobs.net"
"40510"," senior insight analyst digital experience","United Kingdom","USD",62000,115000,"E-commerce; Excel; Python; SQL","ai-jobs.net"
"40534"," embedded c engineer for computer vision robotics","Poland","USD",62000,115000,"Agile; C++; CI/CD; Computer Science; Computer Vision; Docker; Engineering; Linux; Machine Learning; Mathematics; ML models; Model deployment; Physics; Python; PyTorch; Research; Robotics; TensorRT; Testing","ai-jobs.net"
"40489"," ai research engineer","United Kingdom","USD",150000,249000,"Computer Science; Computer Vision; Data analysis; Deep Learning; Engineering; NLP; PhD; Python; PyTorch; R; R&D; Research; STEM; TensorFlow; Testing","ai-jobs.net"
"40571"," data engineer visualization expert","Switzerland","USD",115000,180000,"Data Analytics; Data quality; Data Warehousing; Economics; Excel; Jira; KPIs; Mathematics; Matplotlib; NumPy; Pandas; Power BI; Prototyping; Python; Qlik; SharePoint; SQL; Statistical modeling; Statistics; Tableau","ai-jobs.net"
"40585"," senior data scientist revenue acceleration remote americas","United States","USD",129000,185000,"Data pipelines; ETL; Excel; Machine Learning; ML models; OOP; Pipelines; Python; SQL","ai-jobs.net"
"40560"," data ml engineer","Israel","USD",77000,180000,"Computer Science; Data pipelines; Engineering; Machine Learning; ML models; MLOps; Pipelines; Python; SQL; Statistical modeling; Statistics; Testing","ai-jobs.net"
"40610"," data engineer","India","USD",115000,180000,"APIs; Architecture; AWS; Azure; Big Data; Business Intelligence; Computer Science; Databricks; Data strategy; Data Warehousing; Engineering; ETL; GCP; ISO 27001; JavaScript; Kafka; Linux; MySQL; Node.js; NumPy; Pandas; PySpark; Python; Redshift; Scala; Snowflake; SQL","ai-jobs.net"
"40503"," staff machine learning developer devops sre","Canada","USD",33000,1e+05,"Ansible; Architecture; DevOps; Distributed Systems; Engineering; Kubernetes; Linux; Machine Learning; Python; Research; Testing","ai-jobs.net"
"40568"," senior data engineer","United States","USD",115000,180000,"Architecture; Data pipelines; Lambda; Machine Learning; ML models; Pipelines; Python; SQL","ai-jobs.net"
"40547"," chemistry data analysislab operations specialist","United States","USD",44000,81000,"Chemistry; Data analysis; Excel; Research; Testing","ai-jobs.net"
"40579"," data engineer customer success operations","United States","USD",115000,180000,"Airflow; APIs; Architecture; BigQuery; Databricks; Data pipelines; Data warehouse; Engineering; Mathematics; Pipelines; Python; Scrum; Snowflake; SQL; Statistics; Testing","ai-jobs.net"
"40529"," sales operations vp data science and consulting solutions","United States","USD",160000,250000,"Agile; Consulting; Economics; Finance; KPIs; Research","ai-jobs.net"
"40618"," senior associate data analytics l","India","USD",45000,84000,"Agile; Consulting; Data Analytics; Engineering; Excel; JavaScript; KPIs; Testing","ai-jobs.net"
"40609"," senior data modeller","Spain","USD",62000,115000,"Agile; Credit risk; Data analysis; Economics; Excel; Machine Learning; Mathematics; ML models; Python; R; Research; SAS; Statistics","ai-jobs.net"
"40553"," data analyst mid level","Philippines","USD",62000,135000,"AWS; Dagster; Engineering; ETL; FinTech; GitHub; PostgreSQL; Python; RDBMS; Research; Snowflake; SQL; Tableau","ai-jobs.net"
"40525"," data scientist","United Kingdom","USD",92000,173000,"Airflow; Architecture; AWS; Data warehouse; Econometrics; ELT; GCP; Pipelines; Python; Research; SQL; TDD","ai-jobs.net"
"40604"," sap data management analyst with german","Romania","USD",39000,73000,"Data management; Finance; Spark","ai-jobs.net"
"40543"," data analyst","United States","USD",92000,130000,"Data analysis; Finance; Looker; OKR; PostgreSQL; Python; Research; Snowflake; SQL; Statistics; Tableau","ai-jobs.net"
"40488"," dataops engineer hf","France","USD",62000,115000,"Agile; Ansible; Big Data; Databricks; DataOps; Data strategy; DevOps; Docker; ELK; Git; Hadoop; Kafka; Kubernetes; Pipelines; Snowflake; Spark; Tableau; Terraform","ai-jobs.net"
"40511"," insight analyst","Poland","USD",39000,73000,"Data Analytics; Economics; Excel; Genetics; Market research; Research","ai-jobs.net"
"40546"," senior data analyst","United States","USD",110000,169000,"A/B testing; Banking; Blockchain; Crypto; CX; Data analysis; Data Analytics; Data governance; Data visualization; KPIs; Looker; SQL; Statistics; Tableau; Testing","ai-jobs.net"
"40491"," internship deep learning based lane and road edge detection","Germany",NA,NA,NA,"Agile; Computer Science; Computer Vision; Deep Learning; Engineering; Python; Spark","ai-jobs.net"
"40542"," research scientist generative speech","United States","USD",61000,126000,"AWS; Deep Learning; Diffusion models; GCP; Generative modeling; Linear algebra; NeurIPS; NLP; PhD; Python; PyTorch; Research; TensorFlow","ai-jobs.net"
"40552"," operations and data analyst","Cyprus","USD",42000,60000,"Computer Science; Crypto; Data analysis; Economics; Engineering; Excel; Finance; Market research; Mathematics; Research","ai-jobs.net"
"40545"," data analyst","United States","USD",75000,120000,"Amplitude; AWS; Computer Science; Data analysis; Data Analytics; Data pipelines; E-commerce; Economics; Looker; Machine Learning; Mathematics; Periscope; Pipelines; Python; RDBMS; Redshift; SQL; Statistics","ai-jobs.net"
"40512"," customer success data management","Brazil","USD",65000,121000,"CX; Data management; Economics; Finance; Privacy","ai-jobs.net"
"40576"," data implementation analyst data engineering","Canada","USD",95000,171000,"APIs; Architecture; Data analysis; Data management; Data visualization; EDA; Engineering; Excel; Git; Pipelines; Python","ai-jobs.net"
"40536"," sr manager product design aiml","Canada","USD",69000,128000,"Agile; Architecture; Engineering; Finance; Machine Learning; Prototyping; Research; Robotics; Security; Testing; UX","ai-jobs.net"
"40537"," aiml engineer","United Kingdom","USD",77000,180000,"Architecture; Computer Science; Engineering; Keras; Machine Learning; Mathematics; ML models; Python; PyTorch; R; Research; Scikit-learn; Statistics","ai-jobs.net"
"40494"," deep learning research engineer","United Kingdom","USD",150000,249000,"Architecture; Computer Vision; Deep Learning; Engineering; Keras; Machine Learning; NeurIPS; Python; PyTorch; Research; TensorFlow","ai-jobs.net"
"40519"," senior data scientist computer vision and mlops","Canada","USD",129000,185000,"AWS; BigQuery; Caffe; Computer Science; Computer Vision; Deep Learning; Docker; Economics; Engineering; GCP; Google Cloud; Keras; Kubernetes; Machine Learning; Mathematics; ML models; MLOps; OpenCV; Physics; PyTorch; SQL; TensorFlow; Testing","ai-jobs.net"
"40505"," sr manager machine learning engineering coupang play","South Korea","USD",131000,201000,"Computer Science; Deep Learning; E-commerce; Engineering; Machine Learning; Mathematics; ML models; PhD; Python; Recommender systems; Research; Statistics","ai-jobs.net"
"40493"," deep learning engineer","United States","USD",63000,117000,"Classification; Computer Science; Computer Vision; CUDA; Deep Learning; Engineering; Machine Learning; MLFlow; Nvidia Jetson; OpenCV; PhD; Pipelines; Privacy; Python; PyTorch; Robotics; TensorFlow; TensorRT","ai-jobs.net"
"40518"," senior data scientist computer vision","Canada","USD",129000,185000,"AWS; BigQuery; Computer Science; Computer Vision; Deep Learning; Docker; Economics; Engineering; GCP; Google Cloud; Keras; Kubernetes; Machine Learning; Mathematics; ML models; OpenCV; Physics; PyTorch; Research; SQL; Testing","ai-jobs.net"
"40581"," developer advocate for healthcare ai products","United States","USD",39000,73000,"Big Data; Clinical NLP; DevOps; Engineering; NLP; Spark","ai-jobs.net"
"40538"," ai solution architect pre sales","United States","USD",129000,149000,"Architecture; AWS; Azure; Big Data; Databricks; Data governance; DataRobot; Data Warehousing; Engineering; Hadoop; JavaScript; Kubeflow; Kubernetes; Machine Learning; Mathematics; MLFlow; OOP; Python; SageMaker; Security; STEM; Teaching; Travel","ai-jobs.net"
"40596"," senior data engineer","India","USD",115000,180000,"AWS; Azure; Big Data; Computer Science; Data pipelines; Data quality; Data Warehousing; Engineering; ETL; GCP; Kafka; Pipelines; Python; Redshift; Scala; Security; Snowflake; Spark; SQL","ai-jobs.net"
"40549"," senior data analyst global internal audit","Costa Rica","USD",42000,60000,"AWS; Data Analytics; Data visualization; Excel; Power BI; Python; RDBMS; SAS; SQL; Tableau","ai-jobs.net"
"40597"," data visualisation engineer hf","France","USD",39000,73000,"Snowflake; SQL; Tableau","ai-jobs.net"
"40592"," sr data engineer","India","USD",115000,180000,"APIs; Azure; Big Data; Business Intelligence; Consulting; Data quality; ELT; ETL; JavaScript; OOP; Python; Snowflake; SQL; Tableau","ai-jobs.net"
"40606"," senior associate data engineering l de big data azure","India","USD",73000,120000,"Agile; Airflow; Architecture; AWS; Azure; Big Data; BigQuery; Cassandra; CI/CD; Consulting; Data Analytics; Data governance; Data management; Data pipelines; Engineering; ETL; Flink; GCP; Hadoop; HBase; HDFS; Informatica; Kafka; MongoDB; MPP; MySQL; NoSQL; Oozie; Oracle; Pipelines; PostgreSQL; Pulsar; Python; Redshift; Scala; Security; Spark; SQL; Streaming; Talend","ai-jobs.net"
"40573"," data engineer","United Kingdom","USD",115000,180000,"Airflow; Architecture; BigQuery; Data pipelines; Data warehouse; GCP; GitHub; Google Cloud; Open Source; Pipelines; Python; Research; SQL; TDD; Terraform","ai-jobs.net"
"40562"," data engineer","Australia","USD",73000,120000,"Agile; Airflow; Architecture; AWS; Big Data; CI/CD; Data Mining; Data pipelines; Data warehouse; EC2; ELT; Engineering; ETL; Lambda; Machine Learning; NoSQL; Pipelines; Python; Redshift; SQL; Statistics; Unstructured data","ai-jobs.net"
"40540"," principal engineer data security cloud backend","United States","USD",69000,128000,"APIs; CI/CD; Computer Science; Golang; JSON; Kubernetes; Node.js; Privacy; Python; Security; TDD; Testing; XML","ai-jobs.net"
"40574"," data engineer","Germany","USD",115000,180000,"Airflow; AWS; Big Data; Data pipelines; Data warehouse; Kafka; OLAP; Pipelines; PostgreSQL; Python; Redshift; Spark; SQL; Streaming; Terraform","ai-jobs.net"
"40497"," staff software engineer machine learning infrastructure","Canada","USD",69000,128000,"Architecture; Data pipelines; Distributed Systems; Engineering; Feature engineering; Lambda; Machine Learning; ML infrastructure; ML models; Model training; Pipelines; Python; Radar; Scala; Spark; Testing","ai-jobs.net"
"40612"," senior data engineer","Tunisia","USD",115000,180000,"Ansible; Azure; Big Data; Computer Science; Distributed Systems; Docker; Engineering; Hadoop; Helm; Kafka; Kubernetes; Microservices; Open Source; Pipelines; Python; R; Scala; Security; Spark; Streaming; Terraform; Unstructured data","ai-jobs.net"
"40504"," associate python machine learning engineer","United Kingdom","USD",80000,129000,"Agile; AWS; Azure; Computer Science; Data management; Data pipelines; Data quality; Docker; Engineering; ETL; GCP; Kafka; Kubernetes; Machine Learning; ML models; MLOps; MongoDB; NumPy; Pandas; Pipelines; PostgreSQL; Privacy; Prototyping; Python; Research; Streaming","ai-jobs.net"
"40498"," software engineer machine learning infrastructure","Canada","USD",69000,128000,"Distributed Systems; Engineering; Machine Learning; ML infrastructure; ML models; Model training; Python; Radar; Testing","ai-jobs.net"
"40615"," data analytics analyst actuarial and analytics solutions aas","South Africa","USD",30000,57000,"AWS; Azure; Business Intelligence; Consulting; Data Analytics; Econometrics; Engineering; Excel; Finance; GCP; Machine Learning; Mathematics; Matlab; Power BI; Python; QlikView; R; Robotics; RPA; SAS; SQL; Statistics; STEM; Tableau","ai-jobs.net"
"40578"," data engineer remote","Indonesia","USD",73000,120000,"Airflow; APIs; Architecture; AWS; Big Data; BigQuery; Databricks; Data pipelines; Engineering; ETL; Flink; GCP; Hadoop; HDFS; Kafka; Machine Learning; ML models; Pipelines; Python; Redshift; Scala; Spark; SQL; STEM; Streaming; Testing","ai-jobs.net"
"40582"," senior vision engineer","Canada","USD",69000,128000,"Architecture; C++; Deep Learning; Engineering; Industrial; OpenCV; Python","ai-jobs.net"
"40515"," staff data scientist experimentation","United States","USD",129000,185000,"Biology; Causal inference; Clustering; Computer Science; Data analysis; Deep Learning; Economics; Engineering; GCP; Google Cloud; Industrial; Machine Learning; Mathematics; Pandas; PhD; Physics; Python; R; Research; SQL; Statistics; Testing","ai-jobs.net"
"40521"," staff data scientist sponsored ads","United States","USD",129000,185000,"Biology; Causal inference; Clustering; Computer Science; Data analysis; Deep Learning; Economics; Engineering; GCP; Google Cloud; Industrial; Machine Learning; Mathematics; Pandas; PhD; Physics; Python; R; Research; SQL; Statistics; Testing","ai-jobs.net"
"40475"," it data engineer private banking","Switzerland","USD",73000,120000,"Azure; Banking; Blockchain; Consulting; Consulting firm; Engineering; Power BI; Research; SQL; T-SQL","ai-jobs.net"
"40580"," senior data engineer","Spain","USD",115000,180000,"Agile; Architecture; Athena; AWS; Data analysis; Data pipelines; Engineering; FinTech; Jira; Lambda; NoSQL; Pipelines; PySpark; Python; R; RDBMS; Redshift; SDLC; Spark; SQL; Testing; Unstructured data","ai-jobs.net"
"40531"," data scientist ia cybersoc hf","France","USD",39000,1e+05,"Angular; Big Data; Business Intelligence; C++; Consulting; Data management; Docker; Git; Kubernetes; Linux; NLP; Node.js; PHP; Python; PyTorch; R; R&D; Transformers","ai-jobs.net"
"40550"," senior business data analyst hf","France","USD",30000,69000,"A/B testing; Agile; Engineering; Power BI; Python; SQL; Tableau; Testing","ai-jobs.net"
"40595"," lead data engineer","Norway","USD",103000,160000,"Agile; Architecture; Big Data; CI/CD; Engineering; HBase; Maven; Oracle; Power BI; RDBMS; Spark; SQL","ai-jobs.net"
"40490"," cloud platform analytics engineer","Canada","USD",110000,184000,"APIs; AWS; Azure; BigQuery; Computer Science; Data Analytics; Data pipelines; Data Warehousing; GCP; KPIs; Looker; Pipelines; PostgreSQL; Power BI; Python; RDBMS; Redshift; Snowflake; SQL; Tableau","ai-jobs.net"
"40527"," session lead external contractor programming for data science nanodegree","Palestine","USD",40000,75000,"Git; Machine Learning; Privacy; Python; SQL; Teaching","ai-jobs.net"
"40590"," lead data analytics","India","USD",55000,102000,"Azure; Data Analytics; Data visualization; ETL; MS SQL; MySQL; Oracle; Power BI; RDBMS; SQL; SSIS; Talend","ai-jobs.net"
"40480"," hedis data analyst spectramedix east windsor new jersey remote hybrid","United States","USD",92000,130000,"Data analysis; Data Analytics; Python; SQL; Tableau","ai-jobs.net"
"40514"," senior google cloud data engineer","Belgium","USD",62000,115000,"Agile; Architecture; CI/CD; Data Analytics; Data pipelines; Data strategy; Engineering; GCP; Golang; Google Cloud; Kafka; Machine Learning; Pipelines; Python; Scrum; Spark; Terraform","ai-jobs.net"
"40561"," software engineer ml team","Israel","USD",55000,102000,"Architecture; AWS; Data pipelines; Deep Learning; Engineering; Genetics; Kafka; Linux; Machine Learning; ML models; NLP; Pipelines; Privacy; Python; R; R&D; Scikit-learn; TensorFlow; Testing","ai-jobs.net"
"40476"," data engineer in digital transformation mwdiv","Germany","USD",61000,135000,"Data Analytics; Julia","ai-jobs.net"
"40551"," senior business data analyst hf","France","USD",30000,69000,"A/B testing; Agile; Engineering; Power BI; Python; SQL; Tableau; Testing","ai-jobs.net"
"40483"," une data scientist","France","USD",39000,1e+05,"Business Analytics; Business Intelligence; Git; Matlab; Oracle; Plotly; Python; R; RapidMiner; SQL; Tableau","ai-jobs.net"
"40593"," data engineer knowledge graph expert","Poland","USD",115000,180000,"APIs; Consulting; Data Analytics; Data pipelines; DevOps; Engineering; Pipelines; Python; RDF; REST API; Spark","ai-jobs.net"
"40524"," data scientist","Hungary","USD",129000,185000,"APIs; Architecture; AWS; Data analysis; Data Mining; Django; EDA; Engineering; Feature engineering; GCP; Google Cloud; Keras; Machine Learning; ML models; NLP; PostgreSQL; Python; PyTorch; SageMaker; Security; SQL; TensorFlow","ai-jobs.net"
"40564"," senior data engineer",NA,"USD",141000,211000,"Airflow; API Development; APIs; Architecture; AWS; Azure; CI/CD; Dagster; Data pipelines; DevOps; Engineering; Helm; Kafka; Kubernetes; Machine Learning; Pipelines; Python; Spark; SQL; Terraform","ai-jobs.net"
"40522"," data scientist","United Kingdom","USD",92000,173000,"A/B testing; AWS; Azure; BigQuery; Computer Science; GCP; Git; GitHub; GitLab; ICML; Julia; Kubernetes; Looker; Machine Learning; Mathematics; ML models; NLP; Open Source; PhD; Python; R; SQL; Statistics; STEM; Terraform; Testing","ai-jobs.net"
"40526"," career coach external contractor programming for data science nanodegree","Palestine","USD",45000,84000,"Machine Learning; Privacy; Teaching","ai-jobs.net"
"40457"," es data scientist","Spain","USD",92000,173000,"AWS; Azure; Big Data; Clustering; Databricks; ETL; GCP; Google Cloud; Machine Learning; MLOps; .NET; Power BI; Python; Qlik; Snowflake; Spark; Tableau","ai-jobs.net"
"40499"," senior machine learning engineer visa ai as a service","United States","USD",109000,139000,"Agile; AI governance; Big Data; C++; Distributed Systems; Golang; Machine Learning; PhD; Privacy; Scrum; Testing","ai-jobs.net"
"40500"," sr machine learning engineer","Canada","USD",131000,201000,"Anaconda; AWS; Big Data; Classification; Engineering; Machine Learning; ML models; NLP; Open Source; Pipelines; Python; PyTorch; Research; SQL; Streaming; Topic modeling","ai-jobs.net"
