"job_id","job_title","location","salary_currency","salary_min","salary_max","job_quals","website"
"38322"," research scientist future product innovation","United States","USD",151000,210000,"Causal inference; Computer Science; Economics; Engineering; Machine Learning; NLP; PhD; Privacy; Prototyping; Research; Robotics; Stable Diffusion; Statistics","ai-jobs.net"
"38319"," head of data analytics fmx","Germany","USD",102000,230000,"Agile; Airflow; Architecture; AWS; BigQuery; Data Analytics; DataOps; Data pipelines; E-commerce; Engineering; ETL; Finance; GCP; Google Cloud; Kafka; KPIs; Looker; MPP; NoSQL; OKR; Pipelines; Power BI; Python; Redshift; Snowflake; SQL; Tableau; Terraform","ai-jobs.net"
"38349"," junior data analytics forecast planning","Portugal","USD",39000,73000,"Computer Science; Data Analytics; Economics; Engineering; Looker; Mathematics; Python; R; Research; SQL; Statistics; Tableau","ai-jobs.net"
"38370"," sr data scientist","India","USD",129000,185000,"BERT; Computer Science; Git; Industrial; Machine Learning; NLP; NumPy; Pandas; Python; Scikit-learn; SQL; Statistics; Transformers; Unstructured data","ai-jobs.net"
"38365"," full stack developer cnetetlssis experian health can be remote anywhere in the us","United States","USD",62000,115000,"Agile; Angular; Architecture; Bitbucket; Computer Science; ETL; JavaScript; Jira; JSON; .NET; React; Security; SQL; SSIS; Testing; XML","ai-jobs.net"
"38373"," data science manager ecommerce","United States","USD",245000,299000,"Banking; Blockchain; Clustering; Crypto; Data warehouse; E-commerce; Engineering; Looker; Machine Learning; Mathematics; Python; SQL; Statistics; STEM","ai-jobs.net"
"38360"," big data graduate program ","United States","USD",44000,81000,"Big Data; Computer Science; Consulting; DevOps; Elasticsearch; Engineering; GCP; Google Cloud; Hadoop; Kubernetes; Mathematics; Physics; Python; R; Scala; Spark; STEM","ai-jobs.net"
"38403"," data engineer","United Kingdom","USD",115000,180000,"AWS; Consulting; Data Warehousing; Engineering; ETL; MS SQL; Oracle; Power BI; SQL; Tableau; Trifacta","ai-jobs.net"
"38409"," data engineer fcr hf","France","USD",115000,180000,"Agile; Architecture; AWS; Databricks; Engineering; Finance; GitLab; PHP; Python; Scrum; Snowflake","ai-jobs.net"
"38418"," lyon data scientist confirmee hf","France","USD",36000,93000,"Architecture; Big Data; C++; Deep Learning; Git; Keras; Machine Learning; Python; PyTorch; TensorFlow","ai-jobs.net"
"38313"," data science analytics internships summer ","United States",NA,NA,NA,"Angular; Architecture; AWS; Databricks; Data visualization; Engineering; Finance; GCP; Google Cloud; JavaScript; Julia; Machine Learning; PySpark; Python; R; Scala; Spark; SQL; Statistics; Streaming; Tableau","ai-jobs.net"
"38333"," it product manager master data management","Poland","USD",62000,115000,"APIs; Computer Science; Data management; Engineering; ITIL; Spark","ai-jobs.net"
"38340"," senior marketing data analyst berlin","Germany","USD",92000,130000,"Data analysis; ETL; Excel; Finance; Snowflake; SQL; Unstructured data","ai-jobs.net"
"38380"," summer internship data science platform mission emea","Sweden",NA,NA,NA,"Agile; Computer Science; Data analysis; Economics; Mathematics; Pandas; Python; R; SQL; Statistics; Streaming; Tableau","ai-jobs.net"
"38390"," senior data engineer","United Kingdom","USD",73000,120000,"Azure; Databricks; Data governance; DevOps; Engineering; Power BI; Python; Scala; Spark; SQL","ai-jobs.net"
"38412"," lyon data engineer hf","France","USD",61000,135000,"Architecture; AWS; Azure; Big Data; GCP; Hadoop; Kafka; Pipelines; Python; Scala; Spark","ai-jobs.net"
"38329"," forward deployed machine learning engineer london","United Kingdom","USD",80000,129000,"Architecture; Computer Vision; Data management; Engineering; Keras; Machine Learning; ML models; MLOps; NLP; Open Source; Python; PyTorch; Research; TensorFlow","ai-jobs.net"
"38395"," senior scientist decision sciences","United States","USD",69000,128000,"A/B testing; Architecture; Clustering; Computer Science; Data analysis; Data management; Economics; Engineering; Feature engineering; Git; Hadoop; Linux; Machine Learning; Mathematics; Physics; PostgreSQL; Privacy; Python; Recommender systems; Research; Scala; Spark; SQL; Statistics; Testing","ai-jobs.net"
"38401"," staff data engineer","United States","USD",69000,128000,"Architecture; Business Intelligence; Consulting; Data analysis; Data Warehousing; JavaScript; KPIs; OOP; Power BI; Python; Snowflake; SQL; Tableau","ai-jobs.net"
"38406"," data analystdba top secret clearance","United States","USD",1e+05,150000,"Computer Science; DevOps; Linux; Neo4j; Research; Security; SQL","ai-jobs.net"
"38398"," actuary data architect sql","United States","USD",135000,195000,"Agile; Big Data; Data analysis; Data governance; Data pipelines; Engineering; OOP; Pipelines; Privacy; Python; R; R&D; Snowflake; SQL; Statistics; STEM","ai-jobs.net"
"38342"," senior marketing data analyst paris","France","USD",92000,130000,"Data analysis; ETL; Excel; Finance; Snowflake; SQL; Unstructured data","ai-jobs.net"
"38327"," seniorstaff software engineer perception machine learning infrastructure","United States","USD",170000,280000,"Autonomous Driving; CI/CD; Data Analytics; Databricks; Data Mining; Data pipelines; Deep Learning; Engineering; Keras; Kubernetes; Machine Learning; MLFlow; ML infrastructure; ML models; MLOps; ONNX; Pipelines; Python; PyTorch; Robotics; Scala; Spark; SQL; Tableau; TensorFlow; TensorRT","ai-jobs.net"
"38347"," senior data analyst hr","United Kingdom","USD",92000,130000,"CX; Data Analytics; Data Studio; GCP; Google Cloud; Looker; Privacy; Python; SQL; Terraform","ai-jobs.net"
"38402"," senior manager data engineering","United States","USD",129000,252000,"Agile; Architecture; AWS; Azure; BigQuery; Bigtable; Computer Science; Consulting; Dataflow; Data pipelines; DynamoDB; ELT; Engineering; ETL; GCP; Google Cloud; Helm; JavaScript; Lambda; MySQL; NoSQL; Oracle; Pipelines; PySpark; Python; Redshift; Scala; SDLC; Spark; SQL; Streaming; Terraform; Testing","ai-jobs.net"
"38352"," senior data analyst channel analytics","South Korea","USD",92000,130000,"Airflow; GitHub; Jira; Privacy; Python; R; SQL; Tableau","ai-jobs.net"
"38399"," senior data engineer","United States","USD",75000,130000,"Agile; APIs; Architecture; AWS; Azure; CI/CD; Distributed Systems; DynamoDB; Engineering; GCP; Git; Hadoop; Pipelines; Python; Scala; Security; Snowflake; Spark; SQL; Teaching","ai-jobs.net"
"38367"," etl developer","United States","USD",63000,250000,"Agile; Big Data; Computer Science; Data analysis; Data quality; ETL; Finance; Git; Hadoop; Informatica; Jira; Oracle; SDLC; SQL","ai-jobs.net"
"38378"," data scientist","Hungary","USD",129000,185000,"Agile; Azure; Business Intelligence; Classification; Clustering; Data Mining; Deep Learning; Docker; Engineering; Kubernetes; Machine Learning; MLFlow; ML models; Physics; Privacy; Python; R; RDBMS; SageMaker; Statistics","ai-jobs.net"
"38337"," data analyst","India","USD",92000,130000,"Banking; Classification; Data analysis; Git; Machine Learning; MS SQL; Power BI; Python; Security; SQL; Statistics; Testing","ai-jobs.net"
"38306"," senior data analyst","India","USD",92000,130000,"A/B testing; Consulting; Data analysis; Data Mining; Economics; Excel; KPIs; Mathematics; PhD; Privacy; Research; SQL; Statistics; Testing","ai-jobs.net"
"38328"," machine learning engineer","Spain","USD",80000,129000,"Agile; APIs; AWS; Azure; CI/CD; Computer Science; Data quality; Deep Learning; Docker; Engineering; Feature engineering; GCP; Git; Kubernetes; Machine Learning; ML models; MLOps; Model training; NLP; Pipelines; Python; PyTorch; TensorFlow","ai-jobs.net"
"38368"," principal clinical data lead","United States","USD",69000,128000,"Biology; Computer Science; Data management; Data strategy; Economics; Mathematics; Statistics","ai-jobs.net"
"38369"," staff data scientist","India","USD",55000,102000,"BERT; Computer Science; Git; Industrial; Machine Learning; NLP; NumPy; Pandas; Python; Scikit-learn; SQL; Statistics; Transformers; Unstructured data","ai-jobs.net"
"38382"," data science analytics internships summer ","United States",NA,NA,NA,"A/B testing; Amplitude; Big Data; BigQuery; Data analysis; Data visualization; Deep Learning; GCP; Google Cloud; KPIs; Looker; Machine Learning; Python; SQL; Statistical modeling; Statistics; Tableau; Testing","ai-jobs.net"
"38308"," data scientist koffie thee","Netherlands","USD",36000,93000,"Agile; DevOps; Engineering; Machine Learning; Scrum","ai-jobs.net"
"38385"," senior data engineer shared services operations hybrid","United States","USD",115000,180000,"APIs; Athena; AWS; Copywriting; Data Analytics; Data governance; Data Mining; EC2; ECS; Engineering; Excel; Finance; Hadoop; Informatica; JavaScript; JSON; Lambda; MongoDB; MySQL; OOP; Oracle; Pipelines; Power BI; Prototyping; Python; Redshift; Robotics; RPA; Security; SharePoint; SQL; Tableau; Testing; XML","ai-jobs.net"
"38299"," cloud sw developer for index search product data management engineering fmdiv","Germany","USD",62000,115000,"Agile; Azure; Big Data; Computer Science; Data management; Engineering; PhD; Spark; UX","ai-jobs.net"
"38323"," senior bi analyst bb growth","United Kingdom","USD",48000,78000,"Amplitude; Architecture; Business Intelligence; Engineering; ETL; Excel; Finance; FinTech; KPIs; Looker; SQL","ai-jobs.net"
"38361"," senior bi developer","United States","USD",110000,140000,"APIs; Architecture; Computer Science; Data warehouse; Data Warehousing; ETL; Finance; FiveTran; OLAP; PostgreSQL; Power BI; Python; Redshift; Security; Snowflake; SQL; Statistics; Tableau","ai-jobs.net"
"38392"," data engineer","United States","USD",105000,205000,"Architecture; Big Data; Business Intelligence; Data pipelines; Data quality; Data warehouse; Engineering; Machine Learning; OLAP; Pipelines; Python; Redshift; Scala; SQL; Streaming","ai-jobs.net"
"38332"," data engineer analytics engineer","Poland","USD",110000,184000,"Agile; Airflow; Data pipelines; Data warehouse; Docker; Git; GitHub; Looker; Metabase; Open Source; Pipelines; Privacy; Python; R; R&D; SQL; Tableau","ai-jobs.net"
"38400"," actuarial associate data engineering analytics lab deal","United States","USD",73000,120000,"Agile; Big Data; Data analysis; Data governance; Data pipelines; Engineering; OOP; Pipelines; Privacy; Python; R; R&D; Snowflake; SQL; Statistics; STEM","ai-jobs.net"
"38314"," data scientist","Latvia","EUR",36000,72000,"Agile; AWS; Big Data; Classification; Clustering; Computer Science; Docker; Engineering; GitLab; Jira; Kafka; Kanban; Keras; Kubernetes; Linear algebra; Machine Learning; Mathematics; Matplotlib; ML models; NumPy; Pandas; Physics; PostgreSQL; Python; PyTorch; Recommender systems; Research; Scala; Scikit-learn; Scrum; Spark; SQL; Statistical modeling; Statistics; TensorFlow","ai-jobs.net"
"38359"," big data graduate programme ","Belgium","USD",39000,73000,"Big Data; Computer Science; DevOps; Elasticsearch; Engineering; GCP; Google Cloud; Hadoop; Kubernetes; Mathematics; Physics; Python; R; Scala; Spark","ai-jobs.net"
"38408"," data analyst","Ireland","USD",62000,135000,"Data analysis; Data quality; Python; R; SQL","ai-jobs.net"
"38371"," lead product data scientist",NA,"USD",1e+05,170000,"A/B testing; Amplitude; Data Analytics; Data governance; E-commerce; Econometrics; Economics; Engineering; KPIs; OKR; Python; SQL; Statistics","ai-jobs.net"
"38366"," etl developer french speaker","Portugal","USD",63000,250000,"Banking; Computer Science; Data quality; ETL; Excel; Oracle; SQL","ai-jobs.net"
"38354"," data analyst  months contract covering parental leave","Australia","USD",62000,135000,"Athena; AWS; Computer Science; Data analysis; Engineering; Machine Learning; Mathematics; Python; R; Redshift; SageMaker; SQL; Statistics; Tableau","ai-jobs.net"
"38298"," data architect digital manufacturing wmd","Germany","USD",135000,195000,"Big Data; C++; Computer Science; Data governance; Python; SQL","ai-jobs.net"
"38334"," master data manager","India","USD",77000,134000,"Architecture; Computer Science; Data management; Data quality","ai-jobs.net"
"38317"," data engineer gcp hf","France","USD",61000,135000,"Architecture; Big Data; GCP; GitLab; Python; SQL","ai-jobs.net"
"38301"," financial data manager","Finland","USD",77000,134000,"Engineering; Finance; Looker; Power BI; SQL; Tableau","ai-jobs.net"
"38345"," data analyst",NA,"USD",92000,130000,"Data visualization; Excel; GCP; Google Cloud; KPIs; Looker; Machine Learning; Python; R; SQL; Tableau","ai-jobs.net"
"38324"," senior machine learning engineer computer vision","United States","USD",131000,201000,"Classification; Computer Vision; Deep Learning; Engineering; Industrial; Keras; Machine Learning; ML models; PhD; Python; PyTorch; Research; Spark; TensorFlow","ai-jobs.net"
"38290"," work student mfd data engineering","Germany","USD",61000,135000,"Airflow; AWS; Computer Science; Engineering; ETL; GCP; Industrial; Linux; Pipelines; Python; R; Spark; SQL","ai-jobs.net"
"38394"," data engineer cloud hf","France","USD",115000,180000,"Agile; Architecture; AWS; Azure; Big Data; ETL; GCP; Hadoop; OLAP; Python; Scala; Spark; Tableau","ai-jobs.net"
"38389"," senior data engineer fully remote","United Kingdom","USD",73000,120000,"Athena; AWS; Big Data; Computer Science; Data pipelines; Data Warehousing; DevOps; Engineering; ETL; Hadoop; NoSQL; Pipelines; Python; Redshift; Spark; SQL; Testing","ai-jobs.net"
"38381"," business analytics leader aws sales insights analytics and data science siads","United States","USD",140000,260000,"Agile; Architecture; AWS; Big Data; Business Analytics; Business Intelligence; Computer Science; Data Analytics; Data management; Engineering; ETL; Finance; Mathematics; Python; QuickSight; R; SAS; Scrum; SDLC; SQL; Statistics; Tableau","ai-jobs.net"
"38393"," data engineer teradata hf","France","USD",61000,135000,"Architecture; Big Data; Qlik; SQL; Teradata","ai-jobs.net"
"38331"," data analytics engineer hf","France","USD",103000,175000,"Agile; Airflow; Architecture; AWS; Big Data; CI/CD; Data Analytics; DevOps; Engineering; Kanban; OKR; Python; Scrum; Snowflake; SQL; Tableau; TDD","ai-jobs.net"
"38391"," project manager data engineering","Germany","USD",73000,120000,"Computer Science; Engineering","ai-jobs.net"
"38297"," data architect","United Kingdom","USD",135000,195000,"Data analysis; Excel; Finance; Power BI; Privacy; SQL","ai-jobs.net"
"38343"," senior marketing data analyst london","United Kingdom","USD",92000,130000,"Data analysis; ETL; Excel; Finance; Snowflake; SQL; Unstructured data","ai-jobs.net"
"38363"," analystpower bi support data visualization","Poland","USD",62000,115000,"Business Intelligence; Data management; Data quality; Data strategy; Data visualization; Engineering; Excel; Finance; KPIs; Power BI; QlikView; SQL; SSIS; Testing","ai-jobs.net"
"38344"," senior data analyst ","Colombia","USD",92000,130000,"Agile; Architecture; DataOps; Data quality; Jira; SQL; Tableau","ai-jobs.net"
"38372"," data science intern","United States",NA,NA,NA,"Biology; Engineering; Machine Learning; Python; Statistics","ai-jobs.net"
"38339"," data analyst","United States","USD",42000,60000,"Computer Science; Data analysis; Engineering; Finance; Mathematics; Power BI; Python; Qlik; R; SQL; Statistics; Tableau","ai-jobs.net"
"38348"," head data analytics card","South Africa","USD",44000,81000,"Business Intelligence; Classification; Computer Science; Data analysis; Data Analytics; Data management; Engineering; Pipelines; SAS; SQL; Statistics","ai-jobs.net"
"38293"," sr data engineer java developer","India","USD",115000,180000,"Agile; Angular; APIs; Architecture; Big Data; Computer Science; DB2; Git; Hadoop; HBase; Kafka; Maven; Microservices; MongoDB; MySQL; NoSQL; PostgreSQL; React; Spark; Testing","ai-jobs.net"
"38346"," data analyst remote","Poland","USD",92000,130000,"Data analysis; Data governance; Data Mining; Data quality; Data visualization; Excel; Jira; KPIs; Power BI; Qlik; RDBMS; SQL; Statistics; Tableau","ai-jobs.net"
"38356"," sql data analyst","United States","USD",42000,60000,"Computer Science; Data Analytics; Excel; KPIs; Mathematics; SQL; Statistics; Teradata","ai-jobs.net"
"38362"," repository administration and data quality dqrs","Portugal","USD",39000,73000,"Banking; Data analysis; Data management; Data quality; Engineering; Finance","ai-jobs.net"
"38384"," data engineer credit card mount laurel nj wilmington de charlotte nc","United States","USD",95000,171000,"Agile; AWS; Azure; Banking; CI/CD; Computer Science; Data visualization; Data warehouse; Data Warehousing; DevOps; Engineering; ETL; Informatica; Mathematics; Oracle; SQL; SSIS; Statistics; Teradata","ai-jobs.net"
"38336"," data architect","Belgium","USD",135000,195000,"APIs; Azure; Big Data; BigQuery; CI/CD; Databricks; Data management; Data quality; DevOps; Engineering; GCP; Google Cloud; Hadoop; NoSQL; Python; Scala; Security; Spark; SQL; Streaming; Teradata; Testing","ai-jobs.net"
"38355"," data analyst","United Kingdom","USD",62000,135000,"Business Intelligence; Data analysis; Data warehouse; Engineering; Power BI; SQL","ai-jobs.net"
"38379"," project manager data science analytics","United Kingdom","USD",62000,115000,"Scrum","ai-jobs.net"
"38304"," stage data analyst power bi hf","France",NA,NA,NA,"Excel; Power BI; Robotics; RPA; SharePoint","ai-jobs.net"
"38357"," senior data analytics manager","United Kingdom","USD",120000,145000,"A/B testing; Amplitude; Banking; Data Analytics; Economics; Machine Learning; Mathematics; ML models; Python; SQL; Statistics; STEM; Testing","ai-jobs.net"
"38255"," data engineer","Mexico","USD",73000,120000,"AWS; CI/CD; Data pipelines; Genetics; Git; Pipelines; PySpark; Python; Spark; SQL; Testing","ai-jobs.net"
"38310"," consultant senior data visualisation hf","France","USD",62000,115000,"Big Data; Data management; PHP; Power BI; Python; Qlik; QlikView; Robotics; RPA; Tableau","ai-jobs.net"
"38241"," senior data engineer","Brazil","USD",115000,180000,"Architecture; Big Data; Computer Science; Data warehouse; DynamoDB; Elasticsearch; Engineering; ETL; GCP; Git; HBase; MongoDB; NoSQL; OLAP; Privacy; Python; SQL","ai-jobs.net"
"38258"," data engineer","India","USD",115000,180000,"Agile; Airflow; AWS; Azure; Banking; Big Data; Consulting; Data Analytics; Data management; Data Warehousing; Django; Engineering; Finance; GCP; Git; MySQL; Node.js; Prototyping; Python; RDBMS; Research; Ruby; Scala; Scrum; Security; Shell scripting; SQL; Testing","ai-jobs.net"
"38275"," race robotic research engineer pipe cutting and welding","United Kingdom","USD",150000,249000,"Engineering; Matlab; PhD; Python; Research; Robotics; VR","ai-jobs.net"
"38243"," senior data engineer","United States","USD",115000,180000,"Architecture; Classification; Computer Science; CSV; Data management; Engineering; JSON; Machine Learning; Mathematics; RDBMS; Security; SQL; Statistics; XML","ai-jobs.net"
"38296"," machine learning engineer  internship programme  months","United Kingdom",NA,NA,NA,"C++; Computer Science; Deep Learning; HPC; Machine Learning; Mathematics; PhD; Physics; Python; PyTorch; TensorFlow; Testing","ai-jobs.net"
"38286"," data architect with aws","Spain","USD",62000,115000,"Architecture; Athena; AWS; Azure; Business Intelligence; Consulting; Databricks; Data governance; Data management; Data quality; Data strategy; Data warehouse; ETL; Kafka; Kinesis; Lambda; Oracle; Pipelines; Power BI; QuickSight; Redshift; SageMaker; Tableau; Talend","ai-jobs.net"
"38221"," data analyst",NA,"USD",92000,130000,"Amplitude; BigQuery; Data quality; Data Studio; Data visualization; Engineering; GCP; Google Cloud; KPIs; Looker; Python; R; SQL; Tableau","ai-jobs.net"
"38268"," lead bi data science","France","USD",62000,115000,"Agile; Big Data; Data analysis; Data Analytics; Databricks; Data quality; Data strategy; E-commerce; Engineering; Finance; FinTech; Kanban; Looker; Machine Learning; NoSQL; Research; Scrum; Snowflake; SQL","ai-jobs.net"
"38267"," research data scientist","United States","USD",90000,173000,"Computer Science; Data visualization; Mathematics; MongoDB; PhD; Physics; Python; Research; Statistics","ai-jobs.net"
"38225"," finance operations data analyst","France","USD",75000,130000,"Business Intelligence; Excel; Finance; Metabase; SQL","ai-jobs.net"
"38236"," software developer machine learning","United States","USD",115000,175000,"Computer Science; Computer Vision; Engineering; Genetics; Jupyter; Machine Learning; OpenCV; Python; PyTorch; TensorFlow; TensorRT","ai-jobs.net"
"38257"," data engineer","United States","USD",95000,120000,"Agile; Architecture; Computer Science; Consulting; Data pipelines; Data quality; Data warehouse; Data Warehousing; Engineering; ETL; Pipelines; Python; Snowflake; SQL; Tableau; Testing","ai-jobs.net"
"38266"," bi developeranalyst","India","USD",55000,102000,"Agile; Architecture; Business Intelligence; Computer Science; Data warehouse; Data Warehousing; ELT; Engineering; Linux; Oracle; RDBMS; Security; Shell scripting; SQL","ai-jobs.net"
"38253"," junior data engineer","United Kingdom","USD",61000,135000,"Consulting; Data Analytics; Data management; DataOps; Data pipelines; Data quality; Engineering; Pipelines; Privacy; PySpark; Python; Sports industry; SQL; Testing","ai-jobs.net"
"38249"," sales data engineer ","Pakistan","USD",115000,180000,"Airflow; Architecture; Big Data; Distributed Systems; Docker; Engineering; Kubernetes; Machine Learning; Privacy; Python; Redshift; Ruby; Scala; Snowflake; SQL","ai-jobs.net"
"38269"," gerente sr de data science vaga afirmativa para mulheres","Brazil","USD",49000,92000,"APIs; Lidar; MongoDB; Python; React; SQL","ai-jobs.net"
"38274"," ainlp researcher hf","France","USD",56000,105000,"Agile; Clustering; Keras; Machine Learning; NLP; Python; PyTorch; TensorFlow; Vue","ai-jobs.net"
"38295"," machine learning engineer researcher  programme","United Kingdom","USD",30000,108000,"C++; Computer Science; Deep Learning; HPC; Machine Learning; Mathematics; PhD; Physics; Python; PyTorch; TensorFlow; Testing","ai-jobs.net"
"38234"," associate manager data analytics","India","USD",45000,84000,"Agile; Azure; Data Analytics; Data visualization; ETL; MS SQL; MySQL; Oracle; Power BI; RDBMS; Scrum; SQL; SSIS; Talend","ai-jobs.net"
"38292"," staff data engineer full stack","India","USD",115000,180000,"Agile; Angular; APIs; Architecture; Big Data; Computer Science; DB2; Git; Hadoop; HBase; Kafka; Maven; Microservices; MongoDB; MySQL; NoSQL; PostgreSQL; React; Spark","ai-jobs.net"
"38303"," referent data cloud big data fh","France","USD",62000,115000,"Agile; Ansible; Architecture; AWS; Azure; Big Data; DevOps; Docker; GCP; Git; GitHub; Google Cloud; Kubernetes; Python; Scala; Snowflake; Spark; SQL","ai-jobs.net"
"38244"," lead data engineer","France","USD",103000,160000,"Agile; Airflow; Architecture; AWS; Azure; Banking; Big Data; CI/CD; Databricks; Data strategy; E-commerce; Engineering; ETL; GCP; GitLab; Hadoop; Kafka; Linux; Looker; Python; Snowflake; Spark","ai-jobs.net"
"38272"," market data specialist feeds","Singapore","USD",70000,148000,"DataOps; Engineering; Linux","ai-jobs.net"
"38263","  engineer data","South Africa","USD",48000,90000,"Agile; APIs; Architecture; Big Data; Data management; Data pipelines; DevOps; Engineering; MS SQL; Pipelines; Security; Spark; SQL; Testing; Unstructured data","ai-jobs.net"
"38250"," director data engineering","India","USD",2e+05,297000,"Agile; Architecture; Big Data; Engineering; Hadoop; KPIs; Market research; PhD; Research; Streaming","ai-jobs.net"
"38311"," compliance reportingdata visualization designer","Portugal","USD",39000,73000,"Banking; Business Intelligence; C++; Data visualization; Excel; Power BI; SQL; Tableau","ai-jobs.net"
"38247"," sql data engineer developer","Mexico","USD",95000,171000,"Agile; DevOps; Git; MS SQL; Power BI; Privacy; SDLC; SQL; SSIS","ai-jobs.net"
"38282"," data cloud data engineer senior consultantmanager open to all locations in aus","Australia","USD",115000,180000,"Agile; Architecture; Athena; AWS; Azure; Big Data; Cassandra; CI/CD; Databricks; Data management; DataOps; Data pipelines; Data quality; Data strategy; Data Warehousing; DevOps; DynamoDB; EC2; Engineering; ETL; Flink; Hadoop; HBase; Kafka; Kinesis; Kubernetes; Lambda; Machine Learning; MongoDB; MySQL; NoSQL; Pipelines; PostgreSQL; Python; R; Redshift; SAS; Scala; Snowflake; Spark; SQL; Statistics; STEM; Streaming; Terraform; Testing","ai-jobs.net"
"38284"," manager provincial data management","South Africa","USD",30000,57000,"Data analysis; Data Analytics; Data management","ai-jobs.net"
"38305"," cp master data analyst","India","USD",92000,130000,"Data analysis; Data Analytics; Data management; DataOps; Data quality; Engineering; Security","ai-jobs.net"
"38300"," master or phd biomedical sciences clinical data manager","Belgium","USD",39000,73000,"PhD; Testing","ai-jobs.net"
"38265"," data architect","Mexico","USD",135000,195000,"Agile; Architecture; Big Data; Business Intelligence; Classification; Data Analytics; Data governance; Data management; Data quality; Data strategy; Data warehouse; Engineering; Privacy","ai-jobs.net"
"38294"," databrickssparkscala senior data engineer contractor inside ir","United Kingdom","USD",115000,180000,"Agile; APIs; Architecture; AWS; Azure; Big Data; Cassandra; Data Analytics; Databricks; Data management; Data quality; Data warehouse; DevOps; ELT; ETL; Kafka; MongoDB; Neo4j; NoSQL; Open Source; Oracle; Pipelines; PostgreSQL; Python; RDBMS; Scala; Spark; SQL; SSIS; Streaming; Talend; Unstructured data","ai-jobs.net"
"38230"," audit analytics centre of excellence data analyst","South Africa","USD",92000,130000,"Accounting concepts; Consulting; Data quality; Excel; Finance; Security; SQL; Testing","ai-jobs.net"
